{
  "schema_version": "1.0",
  "scan_metadata": {
    "tool": "nmap",
    "target": "192.168.56.101",
    "scope_authorized": true,
    "scanned_at": "2026-10-17T10:30:00Z"
  },
  "findings": [
    {
      "id": "F-001",
      "title": "Outdated OpenSSH version exposed",
      "severity": "medium",
      "evidence": [
        { "source": "nmap", "quote": "22/tcp open ssh OpenSSH 7.2p2 Ubuntu 4ubuntu2.10" }
      ],
      "plain_explanation": "The scan found an SSH service reporting an old version. Old versions often have known bugs that newer releases fixed.",
      "risk": "Attackers can look up known issues for this version and try them against the server.",
      "remediation": [
        "Upgrade OpenSSH to a currently supported release.",
        "Restrict SSH access to trusted IP ranges with a firewall."
      ],
      "references": ["CVE-2016-6210"],
      "verified": true,
      "verifier_notes": "Port, service and version found in parsed Nmap data. Reported by scan, not confirmed exploitable."
    }
  ],
  "summary": {
    "counts": { "critical": 0, "high": 0, "medium": 1, "low": 0, "info": 0 }
  }
}
